### ISSUE TITLE
iscsistart not cleaning up session if login fails

### ISSUE THREAD

**Issue by maxnet** [open-iscsi/open-iscsi#121]
I call `iscsistart` on boot from an initramfs.
For reasons I have not figured out yet, connecting to my iSCSI target sometimes fails.

Shows up in dmesg like:

```
connection1:0: detected conn error (1011)
```

If `iscsistart` returns an exit code, I simply let my script sleep for a second, and try it a second time.
This used to work at some point in the past (using an ancient version of iscsistart).

But when I try it now using latest code from git, subsequent tries always seems to return: `iscsistart: initator reported error (15 - session exists)` 
Like it fails to clean up the session if logging in fails.

**Comment by maxnet** [comment]
Looking at network traffic, it confirms the first login attempt is rejected by my NAS with a "service unavailable" error.
Probably because there is some maximum connection limit reached (previous boot didn't logout of the target cleanly, and it hasn't timed out yet)

```
No.     Time        Source                Destination           Protocol Length Info
      8 0.019153    192.168.178.226       192.168.178.99        iSCSI    230    Login Command

Frame 8: 230 bytes on wire (1840 bits), 230 bytes captured (1840 bits)
Ethernet II, Src: Raspberr_42:9d:d6 (b8:27:eb:42:9d:d6), Dst: Synology_82:c8:9f (00:11:32:82:c8:9f)
Internet Protocol Version 4, Src: 192.168.178.226 (192.168.178.226), Dst: 192.168.178.99 (192.168.178.99)
Transmission Control Protocol, Src Port: 35544 (35544), Dst Port: 3260 (3260), Seq: 49, Ack: 1, Len: 164
[2 Reassembled TCP Segments (212 bytes): #6(48), #8(164)]
iSCSI (Login Command)
    Opcode: Login Command (0x03)
    1... .... = T: Transit to next login stage
    .0.. .... = C: Text is complete
    .... 00.. = CSG: Security negotiation (0x00)
    .... ..01 = NSG: Operational negotiation (0x01)
    VersionMax: 0x00
    VersionMin: 0x00
    TotalAHSLength: 0x00
    DataSegmentLength: 161 (0x000000a1)
    ISID: 00023d000001
    TSIH: 0x0000
    InitiatorTaskTag: 0x00000000
    CID: 0x0000
    CmdSN: 0x00000000
    ExpStatSN: 0x00000000
    Key/Value Pairs
    Padding: 000000

No.     Time        Source                Destination           Protocol Length Info
      9 0.019165    192.168.178.99        192.168.178.226       TCP      66     3260→35544 [ACK] Seq=1 Ack=213 Win=30080 Len=0 TSval=4335909 TSecr=3771291780

Frame 9: 66 bytes on wire (528 bits), 66 bytes captured (528 bits)
Ethernet II, Src: Synology_82:c8:9f (00:11:32:82:c8:9f), Dst: Raspberr_42:9d:d6 (b8:27:eb:42:9d:d6)
Internet Protocol Version 4, Src: 192.168.178.99 (192.168.178.99), Dst: 192.168.178.226 (192.168.178.226)
Transmission Control Protocol, Src Port: 3260 (3260), Dst Port: 35544 (35544), Seq: 1, Ack: 213, Len: 0

No.     Time        Source                Destination           Protocol Length Info
     10 15.035030   192.168.178.99        192.168.178.226       iSCSI    114    Login Response (Service unavailable)

Frame 10: 114 bytes on wire (912 bits), 114 bytes captured (912 bits)
Ethernet II, Src: Synology_82:c8:9f (00:11:32:82:c8:9f), Dst: Raspberr_42:9d:d6 (b8:27:eb:42:9d:d6)
Internet Protocol Version 4, Src: 192.168.178.99 (192.168.178.99), Dst: 192.168.178.226 (192.168.178.226)
Transmission Control Protocol, Src Port: 3260 (3260), Dst Port: 35544 (35544), Seq: 1, Ack: 213, Len: 48
iSCSI (Login Response)
    Opcode: Login Response (0x23)
    0... .... = T: Stay in current login stage
    .0.. .... = C: Text is complete
    .... 00.. = CSG: Security negotiation (0x00)
    VersionMax: 0x00
    VersionActive: 0x00
    TotalAHSLength: 0x00
    DataSegmentLength: 0 (0x00000000)
    ISID: 000000000000
    TSIH: 0x0000
    InitiatorTaskTag: 0x00000000
    StatSN: 0x00000000
    ExpCmdSN: 0x00000000
    MaxCmdSN: 0x00000000
    Status: Service unavailable (0x0301)
```

Last lines of iscsistart output (with debugging enabled):

```
iscsistart: sending login PDU with current stage 0, next stage 1, transit 0x80, isid 0x00023d000001 exp_statsn 0
iscsistart: >    InitiatorName=iqn.2012-08.com.berryboot:myPi
iscsistart: >    InitiatorAlias=berryboot
iscsistart: >    TargetName=iqn.2000-01.com.synology:ds918.Target-1
iscsistart: >    SessionType=Normal
iscsistart: >    AuthMethod=CHAP,None
iscsistart: in ksend_pdu_begin
iscsistart: send PDU began for hdr 48 bytes and data 164 bytes
iscsistart: in kwritev
iscsistart: wrote 48 bytes of PDU header
iscsistart: in kwritev
iscsistart: wrote 164 bytes of PDU data
iscsistart: in ksend_pdu_end
iscsistart: in __kipc_call
iscsistart: in kwritev
iscsistart: in nlpayload_read
iscsistart: in nlpayload_read
iscsistart: send PDU finished for conn 1:0
iscsistart: thread 00be7e28 done
iscsistart: poll result 1
iscsistart: match session [iqn.2000-01.com.synology:ds918.Target-1,192.168.178.99,3260][default tcp,,]:0
iscsistart: to [iqn.2000-01.com.synology:ds918.Target-1,192.168.178.99,3260][default tcp,,]:0
iscsistart: mgmt_ipc_write_rsp: rsp to fd 9
iscsistart: current time 13
iscsistartiscsistart: : thread 0initiator reported error (015bf3750 -  due session exists29), wait 
8569569660968632324 more
iscsistart: poll result 1
iscsistart: mgmt_ipc_write_rsp: rsp to fd 9
iscsistart: in ctldev_close
iscsistart: Releasing session 0xbeb958
iscsistart: iscsi child done
```

Naturally, that it is turned away by the target, is not something that iscsistart can help.
However subsequently invoking iscsistart one more time does not generate any network traffic, and just fails with the `session exists` error.

```
iscsistart: in ctldev_open
iscsistart: created NETLINK_ISCSI socket...
iscsistart: InitiatorName=iqn.2012-08.com.berryboot:myPi
iscsistart: InitiatorAlias=berryboot
iscsistart: TargetName=iqn.2000-01.com.synology:ds918.Target-1
iscsistart: TPGT=1
iscsistart: IP Address=192.168.178.99
iscsistart: version 2.0-876
iscsistart: current time 91
iscsistart: nothing on pend_list, deactivating alarm
iscsistart: poll result 1
iscsistart: sysfs_attr_get_value: open '/class/iscsi_session/session1'/'targetname'
iscsistart: sysfs_attr_get_value: open '/class/iscsi_session/session1'/'username'
iscsistart: sysfs_attr_get_value: open '/class/iscsi_session/session1'/'password'
iscsistart: sysfs_attr_get_value: open '/class/iscsi_session/session1'/'username_in'
iscsistart: could not read username in: 5
iscsistart: sysfs_attr_get_value: open '/class/iscsi_session/session1'/'password_in'
iscsistart: could not read password in: 5
iscsistart: sysfs_attr_get_value: open '/class/iscsi_session/session1'/'recovery_tmo'
iscsistart: sysfs_attr_get_value: open '/class/iscsi_session/session1'/'lu_reset_tmo'
iscsistart: sysfs_attr_get_value: open '/class/iscsi_session/session1'/'tgt_reset_tmo'
iscsistart: sysfs_attr_get_value: open '/class/iscsi_session/session1'/'abort_tmo'
iscsistart: sysfs_attr_get_value: open '/class/iscsi_session/session1'/'tpgt'
iscsistart: sysfs_attr_get_value: open '/class/iscsi_connection/connection1:0'/'persistent_address'
iscsistart: sysfs_attr_get_value: open '/class/iscsi_connection/connection1:0'/'address'
iscsistart: sysfs_attr_get_value: open '/class/iscsi_connection/connection1:0'/'persistent_port'
iscsistart: sysfs_attr_get_value: open '/class/iscsi_connection/connection1:0'/'port'
iscsistart: sysfs_device_get: open '/class/iscsi_session/session1'
iscsistart: sysfs_resolve_link: path link '/class/iscsi_session/session1' points to '../../devices/platform/host0/session1/iscsi_session/session1'
iscsistart: sysfs_resolve_link: base '/class/iscsi_session/session1', tail 'devices/platform/host0/session1/iscsi_session/session1', back 2
iscsistart: sysfs_resolve_link: after moving back ''
iscsistart: sysfs_device_get: new uncached device '/devices/platform/host0/session1/iscsi_session/session1'
iscsistart: sysfs_device_set_values: kernel='session1'
iscsistart: sysfs_device_set_values: kernel_number='1'
iscsistart: sysfs_device_get: subsystem link '/sys/devices/platform/host0/session1/iscsi_session/session1/subsystem' points to '../../../../../../class/iscsi_session'
iscsistart: sysfs_device_get: add to cache 'devpath=/devices/platform/host0/session1/iscsi_session/session1', subsystem='iscsi_session', driver=''
iscsistart: sysfs_device_get_parent: open '/devices/platform/host0/session1/iscsi_session/session1'
iscsistart: sysfs_device_get_parent: '/devices/platform/host0/session1/iscsi_session/session1'
iscsistart: sysfs_device_get: open '/devices/platform/host0/session1/iscsi_session'
iscsistart: sysfs_device_get: new uncached device '/devices/platform/host0/session1/iscsi_session'
iscsistart: sysfs_device_set_values: kernel='iscsi_session'
iscsistart: sysfs_device_set_values: kernel_number=''
iscsistart: sysfs_device_get: add to cache 'devpath=/devices/platform/host0/session1/iscsi_session', subsystem='', driver=''
iscsistart: sysfs_device_get_parent: open '/devices/platform/host0/session1/iscsi_session'
iscsistart: sysfs_device_get_parent: '/devices/platform/host0/session1/iscsi_session'
iscsistart: sysfs_device_get: open '/devices/platform/host0/session1'
iscsistart: sysfs_device_get: new uncached device '/devices/platform/host0/session1'
iscsistart: sysfs_device_set_values: kernel='session1'
iscsistart: sysfs_device_set_values: kernel_number='1'
iscsistart: sysfs_device_get: add to cache 'devpath=/devices/platform/host0/session1', subsystem='', driver=''
iscsistart: sysfs_device_get_parent: open '/devices/platform/host0/session1'
iscsistart: sysfs_device_get_parent: '/devices/platform/host0/session1'
iscsistart: sysfs_device_get: open '/devices/platform/host0'
iscsistart: sysfs_device_get: new uncached device '/devices/platform/host0'
iscsistart: sysfs_device_set_values: kernel='host0'
iscsistart: sysfs_device_set_values: kernel_number='0'
iscsistart: sysfs_device_get: subsystem link '/sys/devices/platform/host0/subsystem' points to '../../../bus/scsi'
iscsistart: sysfs_device_get: add to cache 'devpath=/devices/platform/host0', subsystem='scsi', driver=''
iscsistart: sysfs_attr_get_value: open '/class/scsi_host/host0'/'proc_name'
iscsistart: in read_transports
iscsistart: Adding new transport tcp
iscsistart: Matched transport tcp
iscsistart: sysfs_attr_get_value: open '/class/iscsi_transport/tcp'/'handle'
iscsistart: sysfs_attr_get_value: open '/class/iscsi_transport/tcp'/'caps'
iscsistart: sysfs_attr_get_value: open '/class/iscsi_host/host0'/'hwaddress'
iscsistart: could not read hwaddress for host0
iscsistart: sysfs_attr_get_value: open '/class/iscsi_host/host0'/'ipaddress'
iscsistart: sysfs_attr_get_value: open '/class/iscsi_host/host0'/'netdev'
iscsistart: could not read netdev for host0
iscsistart: sysfs_attr_get_value: open '/class/iscsi_session/session1'/'initiatorname'
iscsistart: sysfs_attr_get_value: open '/class/iscsi_host/host0'/'port_state'
iscsistart: sysfs_attr_get_value: stat '/sys/class/iscsi_host/host0/port_state' failed: No such file or directory
iscsistart: Could not read attr port_state on path /class/iscsi_host/host0
iscsistart: sysfs_attr_get_value: open '/class/iscsi_host/host0'/'port_speed'
iscsistart: sysfs_attr_get_value: stat '/sys/class/iscsi_host/host0/port_speed' failed: No such file or directory
iscsistart: Could not read attr port_speed on path /class/iscsi_host/host0
iscsistart: sysfs_attr_get_value: open '/class/iscsi_session/session1'/'ifacename'
iscsistart: found targetname iqn.2000-01.com.synology:ds918.Target-1 address 192.168.178.99 pers address 192.168.178.99 port 3260 pers port 3260 driver tcp iface name default ipaddress 192.168.178.226 netdev  hwaddress  iname iqn.2012-08.com.berryboot:myPi
iscsistart: match session [iqn.2000-01.com.synology:ds918.Target-1,192.168.178.99,3260][default tcp,,]:0
iscsistart: to [iqn.2000-01.com.synology:ds918.Target-1,192.168.178.99,3260][default tcp,,192.168.178.226]:1
iscsistart: mgmt_ipc_write_rsp: rsp to fd 6
iscsistart: current time 92
iscsistart: iscsistartnothing on pend_list, deactivating alarm: 
initiator reported error (15 - session exists)
iscsistart: poll result 1
iscsistart: mgmt_ipc_write_rsp: rsp to fd 6
iscsistart: in ctldev_close
iscsistart: iscsi child done
```

While the behavior I would like to see instead is that it actually attempts logging in one more time...

**Comment by gonzoleeman** [comment]
Is this still an issue?

I'm guessing the first failed login attempt causes the kernel to retry the login, which is why there is still a session. A session structure gets created, if before the login succeeds, so "iscsiadm -m session" will show a session, but there's no device from it yet. In this case, the session will go away when the attempts timeout or the login succeeds, whichever comes first.

I'm marking this as stale because of it's age, so let me know if that's not the case.

**Comment by gamelaster** [comment]
Also happens to me, `iscsistart version 2.0-874`, `tgt ver 1.0.47`. I have totally same issue. When I connect via `iscsiadm` login is successful, but I don't see any attached iSCSI disk. Can be this because missing some kernel modules?

**Comment by gonzoleeman** [comment]
> Also happens to me, `iscsistart version 2.0-874`, `tgt ver 1.0.47`. I have totally same issue. When I connect via `iscsiadm` login is successful, but I don't see any attached iSCSI disk. Can be this because missing some kernel modules?
> 
> EDIT: I was right, I added some SCSI/iSCSI kernel modules both on target and initiator, and now everything works well

Does this mean that you no longer have an issue with iscsistart, or just that you now have a disc show up when you use iscsiadm to recover?

**Comment by gamelaster** [comment]
> Does this mean that you no longer have an issue with iscsistart, or just that you now have a disc show up when you use iscsiadm to recover?

Both, disc show up and also it boots successfully.

**Comment by gonzoleeman** [comment]
@gamelaster good news. I will assume that this issue is fixed and close it. Please re-open or file a new issue as needed.

**Comment by ravikumarbhattiprolu** [comment]
> Also happens to me, `iscsistart version 2.0-874`, `tgt ver 1.0.47`. I have totally same issue. When I connect via `iscsiadm` login is successful, but I don't see any attached iSCSI disk. Can be this because missing some kernel modules?
> 
> EDIT: I was right, I added some SCSI/iSCSI kernel modules both on target and initiator, and now everything works well

I am facing the exactly same issue mostly with ipv6. Can you please let me know what were the missing kernel modules?

**Comment by gamelaster** [comment]
@ravikumarbhattiprolu I mostly enabled all SCSI/iSCSI modules I found relevant.
